{
  "$schema": "https://json-schema.org/draft-07/schema",
  "type": "array",
  "items": {
    "type": "object",
    "additionalProperties": false,
    "properties": {
      "name": {
        "type": "string"
      },
      "source": { "$ref": "shared/enums.schema.json#/definitions/source" },
      "stats": { "$ref": "shared/objects.schema.json#/definitions/stats" },
      "chassis_abilities": {
        "type": "array",
        "items": {
          "$ref": "shared/objects.schema.json#/definitions/action"
        }
      },
      "description": {
        "type": "string"
      },
      "patterns": {
        "type": "array",
        "items": {
          "type": "object",
          "additionalProperties": false,
          "properties": {
            "name": {
              "type": "string"
            },
            "description": {
              "type": "string"
            },
            "legalStarting": {
              "type": "boolean"
            },
            "systems": {
              "type": "array",
              "items": { "type": "string" }
            },
            "modules": {
              "type": "array",
              "items": { "type": "string" }
            },
            "drone": {
              "type": "object",
              "additionalProperties": false,
              "properties": {
                "systems": {
                  "type": "array",
                  "items": { "type": "string" }
                },
                "modules": {
                  "type": "array",
                  "items": { "type": "string" }
                }
              }
            }
          }
        }
      },
      "page": { "type": "number" }
    }
  }
}
